tweet_id,Username,text,Artist,created_at
1649822390237511681,EricksonIzayah,"After a lengthy suspension, Twitch lifts the ban on the popular rapper and streamer DeAndre Cortez Way, known professionally as Soulja Boy",Soulja Boy,2023-04-22 17:08:04+00:00
1647978231365025793,ScammaBoyRugEm,"Now or DeAndre Cortez Way, in a tweet to your million followers, you claimed you had 'found' th",Soulja Boy,2023-04-17 15:00:02+00:00
1650208093014315010,jansalmanali8,Really enjoyed it ..very good music..Thanks alot Soulja Boy for posting it. The music is very awesome. The vedio is,Soulja Boy,2023-04-23 18:40:43+00:00
1650207832245977090,HolaOscarCruz,Soulja Boy streaming Yu-Gi-Oh Master Duel on his Twitch channel wasnt on my list this year wtf,Soulja Boy,2023-04-23 18:39:41+00:00
1650206838799970304,PlatinumCreater,"Liu Kang Soulja Boy ""They be going insane.""",Soulja Boy,2023-04-23 18:35:44+00:00
1650205779134119940,eyitaio,And the man na werey if your verse wack he go commot am ask Soulja boy,Soulja Boy,2023-04-23 18:31:31+00:00
1650205282377531403,nftcrea59537357,"Tron Founder Justin Sun, Soulja Boy, and Austin Mahone Summoned by SEC in Crypto Asset Case BitcoinNews",Soulja Boy,2023-04-23 18:29:33+00:00
1650205274848866306,ganiket19me,"Tron Founder Justin Sun, Soulja Boy, and Austin Mahone Summoned by SEC in Crypto Asset Case BitcoinNews",Soulja Boy,2023-04-23 18:29:31+00:00
1650205268158840840,RajabSaleem9,"Tron Founder Justin Sun, Soulja Boy, and Austin Mahone Summoned by SEC in Crypto Asset Case BitcoinNews",Soulja Boy,2023-04-23 18:29:29+00:00
1650205131550408704,OGigiovanni,crank that Soulja Boy,Soulja Boy,2023-04-23 18:28:57+00:00
1650203616517472256,TopCrypto_News,"Tom Emmer's questioning of Gary Gensler regarding crypto regulations goes viral on Twitter. Meanwhile, regulators i",Soulja Boy,2023-04-23 18:22:56+00:00
1650203031441399809,GhostOfMufasa_,Omfg Soulja Boy streaming Master Duel this could potentially be the greatest Twitch content of all time,Soulja Boy,2023-04-23 18:20:36+00:00
1650200544244269057,souljabotem,Soulja Boy fetch em!,Soulja Boy,2023-04-23 18:10:43+00:00
1650200254325882880,StrawberryNG,Soulja Boys history of shilling crypto scams was brought to light this week by one crypto sleuth.,Soulja Boy,2023-04-23 18:09:34+00:00
1650200013090193408,webnowcompany,Soulja Boys history of shilling crypto scams was brought to light this week by one crypto sleuth....Read more:,Soulja Boy,2023-04-23 18:08:37+00:00
1650199754528227331,yeoifying,not soulja boy being in one of the best songs in k-pop historyion even like rap but him bi and devita slayed,Soulja Boy,2023-04-23 18:07:35+00:00
1650197629580763136,Avalonjack,Im watching Soulja Boy play Yugioh this feels like a fever dream,Soulja Boy,2023-04-23 17:59:08+00:00
1650196567306170369,certifiedhtrboy,god im your hardest soulja boy but loosen up your grip on my reality its getting crazier each day,Soulja Boy,2023-04-23 17:54:55+00:00
1650196421621039105,bluedreamy710,Soulja boy,Soulja Boy,2023-04-23 17:54:20+00:00
1650189783379898369,AndrxICollinz,aye man say maaan ion wanna be Soulja Boy but yall do know I was the ST SKII AROUND THIS BITCH.,Soulja Boy,2023-04-23 17:27:58+00:00
1650189652735799296,LordSweepy,Got an ad for the US Military on a SOulja Boy yugioh live stream. What a time to be alive.,Soulja Boy,2023-04-23 17:27:26+00:00
1650188237938348032,MaiconXXVI,Soulja Boy falando do Drake,Soulja Boy,2023-04-23 17:21:49+00:00
1650187317418631169,ArkyDraws,"Shinji, crank that Soulja Boy -Asuka",Soulja Boy,2023-04-23 17:18:10+00:00
1650186593469071361,assistroids,Soulja boy up in this ho,Soulja Boy,2023-04-23 17:15:17+00:00
1650185728184184836,BrandonFulmore,YOU!!!! Soulja Boy Tellem,Soulja Boy,2023-04-23 17:11:51+00:00
1650185445572067328,souljabotem,Soulja Boy cast em!,Soulja Boy,2023-04-23 17:10:43+00:00
1650183965196578818,evilderpyhooves,soulja boy,Soulja Boy,2023-04-23 17:04:50+00:00
1650183322503454720,glory_manz,Soulja Boy online playing Yu Gi Oh,Soulja Boy,2023-04-23 17:02:17+00:00
1650183054420328449,BreckinMathias,"""YuuSoulja Boy Tell 'EmAyy, I got this new dance for y'all called the Soulja BoyYou just gotta punch, then cr",Soulja Boy,2023-04-23 17:01:13+00:00
1650182209536417800,RDKTatsku,No way this man Soulja Boy playing Master Duel,Soulja Boy,2023-04-23 16:57:52+00:00
1650180308119986183,ExaRocket,Soulja boy tell em,Soulja Boy,2023-04-23 16:50:18+00:00
1650178969621393410,souljaboy,Soulja Boy TV: Season Episode,Soulja Boy,2023-04-23 16:44:59+00:00
1650177036705464321,KimKRaps,Baby kiss me through the phone. -Soulja Boy,Soulja Boy,2023-04-23 16:37:19+00:00
1650173675046412288,lovekha499,Soulja boy tell em. Ayy. Another new hit track release by soulja boy. It really sent me to euphoria. Also the quali,Soulja Boy,2023-04-23 16:23:57+00:00
1650171146023600129,PabloTheClownV2,tf happend to soulja boy,Soulja Boy,2023-04-23 16:13:54+00:00
1650170345989521408,souljabotem,Soulja Boy differed em!,Soulja Boy,2023-04-23 16:10:43+00:00
1650167607847256065,BenjiSocrates,soulja boy finna get hit wit the cl2 havnis n uninstall the game,Soulja Boy,2023-04-23 15:59:50+00:00
1650167490834563074,SoDopeJeff,Soulja Boy dissed you and nobody talk about ts enough cause he really got off,Soulja Boy,2023-04-23 15:59:23+00:00
1650165453522608128,BooRxdley,Soulja Boy,Soulja Boy,2023-04-23 15:51:17+00:00
1650165032552919041,nervousyoungmae,soulja boy tell em,Soulja Boy,2023-04-23 15:49:37+00:00
1650159608575426560,Jake46524436,"shinji, crank that soulja boy",Soulja Boy,2023-04-23 15:28:03+00:00
1650155244184018946,souljabotem,Soulja Boy passed em!,Soulja Boy,2023-04-23 15:10:43+00:00
1650149223520673799,awwwBritt,the spirit of Soulja Boy overtook me this morning,Soulja Boy,2023-04-23 14:46:47+00:00
1650148653191888901,banewastaken,Soulja boy up in this hoe,Soulja Boy,2023-04-23 14:44:31+00:00
1650146524817391616,alaysianorris,I remember when crank that soulja boy came out me and my dad was outside gettin lit wit the music up,Soulja Boy,2023-04-23 14:36:04+00:00
1650145711873220608,DoitStepbro,Soulja boy reacting to tear would be so funny,Soulja Boy,2023-04-23 14:32:50+00:00
1650145295760601088,CRC_Wabisabi,YOU! ....soulja boy i tell em,Soulja Boy,2023-04-23 14:31:11+00:00
1650141388074364928,BoBnfishy,Outright lie we all know Soulja boy doesn't have fans,Soulja Boy,2023-04-23 14:15:39+00:00
1650140770123259904,GoksenHank,On-Chain Researcher ZachXBT Reveals the Shilling Adventures of Soulja Boy /,Soulja Boy,2023-04-23 14:13:12+00:00
1650140146031886337,souljabotem,Soulja Boy befell em!,Soulja Boy,2023-04-23 14:10:43+00:00
1650138765980233728,RBDSTN,When do we get Soulja Boy cranking that Branded Fusion,Soulja Boy,2023-04-23 14:05:14+00:00
1650138594559012869,ner_pai,Soulja boy Tell'um,Soulja Boy,2023-04-23 14:04:33+00:00
1650137850640232455,ZografosDinos,She soulja on my boy till I crank it.,Soulja Boy,2023-04-23 14:01:36+00:00
1650136390665895937,PresidentOtus_,Let Soulja boy sell fake Yums or Soulja stars you call them the most things and me but when its these little pimps,Soulja Boy,2023-04-23 13:55:48+00:00
1650133140248166400,KNDIAN1998,"Yea maybe Im lookin at it wrong, it look like she Soulja Boyd his ass",Soulja Boy,2023-04-23 13:42:53+00:00
1650128851719057412,dullszzz,And a soulja boy cd,Soulja Boy,2023-04-23 13:25:50+00:00
1650127493070725120,chiemela____,Kiss me through the phon - Soulja boy,Soulja Boy,2023-04-23 13:20:26+00:00
1650125044499066881,souljabotem,Soulja Boy abashed em!,Soulja Boy,2023-04-23 13:10:43+00:00
1650121145671196673,ghostmongaming,just found out Kodak Black has a gaming channel and damn this blows when Soulja Boy played Runescape out the water,Soulja Boy,2023-04-23 12:55:13+00:00
1650119669439709185,Manicfmonline,Soulja Boy - Crank That (Tommy x Sico Vox),Soulja Boy,2023-04-23 12:49:21+00:00
1650116689495719938,Ref_Refiloe,"Probably even more than Renaissance. What, hold up is built on. Bringing together a Yeah Yeah Yeahs sample with a",Soulja Boy,2023-04-23 12:37:31+00:00
1650116300100993024,3qtips,Just found out sharks can't crank that Soulja Boy and I am devastated,Soulja Boy,2023-04-23 12:35:58+00:00
1650115124340899843,ssradio1,Now playing Troy Ave ft Soulja Boy - Dracos And Glocks (Dirty) on Street Style Radio,Soulja Boy,2023-04-23 12:31:17+00:00
1650114711663575040,LastKingMal,Im still waiting for Chris Brown Vs Soulja Boy.,Soulja Boy,2023-04-23 12:29:39+00:00
1650109948091670528,souljabotem,Soulja Boy shoot em!,Soulja Boy,2023-04-23 12:10:43+00:00
1650108632279785473,WhatUpKlayy,Soulja Boy on Ice Cream Paint Job.,Soulja Boy,2023-04-23 12:05:30+00:00
1650094848622428160,souljabotem,Soulja Boy kept em!,Soulja Boy,2023-04-23 11:10:43+00:00
1650093378770718721,domoluvr123,soulja boy tellem,Soulja Boy,2023-04-23 11:04:53+00:00
1650091715892584449,TonyAstroVEVO,. //BACAO RHYTHM &amp; STEEL BAND A thoroughly impressive Funk album with HEAVY emphasis on steel drums. This st,Soulja Boy,2023-04-23 10:58:16+00:00
1650089757597134851,ReecRadio,Soulja Boy ft. French Montana - She Make It Clap REMIX (Clean) - MP3WAXX,Soulja Boy,2023-04-23 10:50:30+00:00
1650089340574285826,UncleNarco,Lmao soulja boy one Nigga that could never keep the same circle. Itd always be funny to me whenever he sign someon,Soulja Boy,2023-04-23 10:48:50+00:00
1650087378759942145,Rodrigt03,He's cranking that soulja boy,Soulja Boy,2023-04-23 10:41:02+00:00
1650079745143447555,souljabotem,Soulja Boy breed em!,Soulja Boy,2023-04-23 10:10:42+00:00
1650073165425528833,TinaSineBebe,"F1: Soulja Boy, Tell Em and Ifani meet",Soulja Boy,2023-04-23 09:44:34+00:00
1650071088901103616,dirtysouthradio,"Maybe (Remix) - Rocko Ft Gucci Mane, Rick Ross, &amp; Soulja Boy",Soulja Boy,2023-04-23 09:36:19+00:00
1650069332422950913,Aminali29711274,"Soulja Boy Has Reportedly Been Cranking Out Promotions for Scam NFT ProjectsBy CD Read more: CoinDesk: Bitcoin, E",Soulja Boy,2023-04-23 09:29:20+00:00
1650068793463574529,ferrariboychris,Red Bottoms &amp; Balenciaga by Soulja Boy on,Soulja Boy,2023-04-23 09:27:11+00:00
1650064645485473792,souljabotem,Soulja Boy own em!,Soulja Boy,2023-04-23 09:10:42+00:00
1650061962607308801,PopHistory1,"December , Swing - Savage featuring Soulja Boy Tellem***written by Demetrius Chris Savage Savelio, Aaro",Soulja Boy,2023-04-23 09:00:03+00:00
1650052235936649217,sofiaajx,In this world you either crank that soulja boy or it cranks you,Soulja Boy,2023-04-23 08:21:24+00:00
1650049550407593984,souljabotem,Soulja Boy justify em!,Soulja Boy,2023-04-23 08:10:43+00:00
1650041986349666304,ejlikethat,"Soulja boy,LA Capone,Luki,FBG Duck,Famous Dex,Lil Reese,Calboy,Chance the rapper,",Soulja Boy,2023-04-23 07:40:40+00:00
1650041623575707649,HHNSradio,Soulja Boy - Bust Down . click &amp; play,Soulja Boy,2023-04-23 07:39:14+00:00
1650039036092772354,shatingstarwol,NOW WATCH ME CRANK THAT SOULJA BOYTHEN SUPERMAN THAT HOEEE,Soulja Boy,2023-04-23 07:28:57+00:00
1650034448178593792,souljabotem,Soulja Boy heal em!,Soulja Boy,2023-04-23 07:10:43+00:00
1650033103002390528,AirDeeGlobal,Anything by Soulja Boy or Masole a Tumelo.,Soulja Boy,2023-04-23 07:05:22+00:00
1650033004159352843,yjcr8_,People that shit in Chief Keef are insane to me because that ngga is more influential that Soulja Boy,Soulja Boy,2023-04-23 07:04:58+00:00
1650032798164459522,enefti_news,Soulja Boy Has Reportedly Been Cranking Out Promotions for Scam NFT Projects - CoinDesk,Soulja Boy,2023-04-23 07:04:09+00:00
1650029752797876230,AlexKennedyNBA,Ill never forget DeShawn and Soulja Boy vs. LeBron and Jay Z Crazy times,Soulja Boy,2023-04-23 06:52:03+00:00
1650029504088113154,AWildGrayson,white teenagers used to think they knew how to DANCE whenever soulja boy came on,Soulja Boy,2023-04-23 06:51:04+00:00
1650023468505677824,todeep4theintro,Nobody wants to hear Kommode in and thats okay. people dont even dont want to hear soulja boy or bow wow.,Soulja Boy,2023-04-23 06:27:05+00:00
1650022683407425537,cm_botlove,IM SO LONELY Soulja boy,Soulja Boy,2023-04-23 06:23:58+00:00
1650019348126236672,souljabotem,Soulja Boy state em!,Soulja Boy,2023-04-23 06:10:43+00:00
1650017350396313603,nvrbinmoretired,why are u playing an almost nola-style bounce mashup of rich girl by gw*n stef*ni after a set soulja boy bid (whi,Soulja Boy,2023-04-23 06:02:46+00:00
1650017097664036864,thecoinerstore,time to super soak that hoe tell emthis aint no soulja boy this the real deal$pepe,Soulja Boy,2023-04-23 06:01:46+00:00
1650015694866505730,Lache71102230,David and Maureen Inside No Soulja Boy - Crank That dance via,Soulja Boy,2023-04-23 05:56:12+00:00
1650013244809961473,HgfgNvcc,"Soulja Boy Has Reportedly Been Cranking Out Promotions for Scam NFT ProjectsBy CD Read more: CoinDesk: Bitcoin, E",Soulja Boy,2023-04-23 05:46:27+00:00
1650013194939691017,HHNSradio,Soulja Boy - Jump in the Bentley . click &amp; play,Soulja Boy,2023-04-23 05:46:16+00:00
1650011056310460416,P0cketpuppyz,"[] hopped up out the bed, turn my swag on - Soulja boy/ appreciated !!",Soulja Boy,2023-04-23 05:37:46+00:00
1650010670493061120,boylial,"marcie, crank that soulja boy",Soulja Boy,2023-04-23 05:36:14+00:00
1650009997231763458,losers_late,"(About to cum) I'm gonna... I'm gonna... YOUUUUU!!(first three notes of ""Crank That Soulja Boy"" on steel drum)",Soulja Boy,2023-04-23 05:33:33+00:00
1650009047574388736,wbor911,Currently spinning: Matt and Kim - I'm a Goner (feat. Soulja Boy &amp; Andrew W.K.),Soulja Boy,2023-04-23 05:29:47+00:00
1650008590403670018,CamUnholy,"Gotta listen to save that shit by chief keef without the soulja boy feature, makes the song a /10 fr",Soulja Boy,2023-04-23 05:27:58+00:00
1650008178699141120,YungLanksta,Soulja boy on twitch play Yu-gi-oh,Soulja Boy,2023-04-23 05:26:20+00:00
1650004250217291778,souljabotem,Soulja Boy requested em!,Soulja Boy,2023-04-23 05:10:43+00:00
1650003046829817857,NightTheNameles,crank that soulja boyMe: NOW WAH ME YOUUUU crank that soulja boyMe: NOW WAH ME,Soulja Boy,2023-04-23 05:05:56+00:00
1650002686828511233,forLF2DO,"T-Pain feat. E-40, Soulja Boy, Shawty Lo, Young Jeezy, Rick Ross, Lil Wayne, &amp; T-Wayne - Like I Outta (Album: Pr33",Soulja Boy,2023-04-23 05:04:30+00:00
1650002255968632832,JRBxAMARO,I confidently think yugioh is at the highest point and only getting more popular Soulja boy playing is wild lmao,Soulja Boy,2023-04-23 05:02:48+00:00
1650002106462486528,___tionna20,"Soulja Boy TV: Episode Season ""SOULJA WORLD RP"" via me on Instagram:",Soulja Boy,2023-04-23 05:02:12+00:00
1650001931413372928,HeadzUpCal,We require you to be the announcer in a boxing event where I sign the contract that Chris Brown did,Soulja Boy,2023-04-23 05:01:30+00:00
1650001229358174209,sharknibbles,"can you crank dat soulja boy a *little* quieter, please? im tryin to get this twink to eat out of a dog bowl and",Soulja Boy,2023-04-23 04:58:43+00:00
1649998625655734273,Welton_abando,"Soulja Boy Has Reportedly Been Cranking Out Promotions for Scam NFT ProjectsBy CD Read more: CoinDesk: Bitcoin, E",Soulja Boy,2023-04-23 04:48:22+00:00
1649996378905493504,KiryuuGaKill,Soulja Boy plays RuneScape????,Soulja Boy,2023-04-23 04:39:26+00:00
1649992584821874690,HHNSradio,Soulja Boy - Turn the Stove On . click &amp; play,Soulja Boy,2023-04-23 04:24:22+00:00
1649990264856129538,hannahrosehawk,lately that soulja boy been crankin me,Soulja Boy,2023-04-23 04:15:09+00:00
1649989761367523328,NovakChristian2,Some days you crank that Soulja boy and some days that Soulja boy cranks you,Soulja Boy,2023-04-23 04:13:09+00:00
1649989151440158721,souljabotem,Soulja Boy slunk em!,Soulja Boy,2023-04-23 04:10:43+00:00
1649975396262133763,therealdomi_,Soulja boy salty these bih love soda,Soulja Boy,2023-04-23 03:16:04+00:00
1649974048510689280,souljabotem,Soulja Boy eyed em!,Soulja Boy,2023-04-23 03:10:42+00:00
1649973530669318146,anueldelbT_Tlla,soulja boy tell em',Soulja Boy,2023-04-23 03:08:39+00:00
1649973038937505793,DonovanxDCx,thought i knew three usher songs and realized it was soulja boy,Soulja Boy,2023-04-23 03:06:42+00:00
1649972468449173505,Gangstaville247,Nowplaying -Tylan f. Soulja Boy - My Type - Happy Holidays!,Soulja Boy,2023-04-23 03:04:26+00:00
1649972088055431168,Skonkuistador,Soulja boy meme got me dying,Soulja Boy,2023-04-23 03:02:55+00:00
1649970779855921152,dirtyromper,Soulja boy said that yous a bitch,Soulja Boy,2023-04-23 02:57:43+00:00
1649969648484470788,BodegaTalksTV,Why is soulja boy randomly in that photo lmao,Soulja Boy,2023-04-23 02:53:13+00:00
1649967606458097665,SaintAleandro,Tripple . You know you called that number. Soulja Boy was your crush. You should be ashamed.,Soulja Boy,2023-04-23 02:45:06+00:00
1649967436618252293,HdDeejays,SOULJA BOY - CRANK THAT (SOULJA BOY) (RADIO),Soulja Boy,2023-04-23 02:44:26+00:00
1649966360800247811,wattitdobabyyy,nobody (myself included) knows the Soulja boy dance,Soulja Boy,2023-04-23 02:40:09+00:00
1649965186634379264,hallucine_ww,soulja boy walked so svt could run,Soulja Boy,2023-04-23 02:35:30+00:00
1649963157983510528,regularob,I wonder how Soulja boy feels about Tisakorean,Soulja Boy,2023-04-23 02:27:26+00:00
1649962568465932288,deaththekid12_,every edaters favorite song is kiss me thru the phone by soulja boy,Soulja Boy,2023-04-23 02:25:05+00:00
1649958950006059008,souljabotem,Soulja Boy signal em!,Soulja Boy,2023-04-23 02:10:43+00:00
1649954130696323072,LetMeDownEasy1,Someone should ask Soulja Boy his thoughts on Tenet.,Soulja Boy,2023-04-23 01:51:34+00:00
1649953958004158464,JennyRogers96,i cranked it too hard - when she dropped her phone while soulja boy was playing,Soulja Boy,2023-04-23 01:50:52+00:00
1649953411868110856,LL_Tisdale,Soulja Boy preforms Crank That,Soulja Boy,2023-04-23 01:48:42+00:00
1649950859416211456,Karitho68110069,Soulja Boy Has Reportedly Been Cranking Out Promotions for Scam NFT Projects,Soulja Boy,2023-04-23 01:38:34+00:00
1649949773800112128,sosweis,Roscoe Dash - All The Way Turnt Up ft. Soulja Boy Tell'em via,Soulja Boy,2023-04-23 01:34:15+00:00
1649949569994887168,DetachedLogic,Soulja boy,Soulja Boy,2023-04-23 01:33:26+00:00
1649949282647023617,TwitchMessages,[pokelawls] pokelawls: lol soulja boy rping,Soulja Boy,2023-04-23 01:32:18+00:00
1649946645503639553,EpikalDotCom,Soulja Boy tell em!,Soulja Boy,2023-04-23 01:21:49+00:00
1649945551083798528,ohthasmike,Soulja boy started the pod cast era back in .,Soulja Boy,2023-04-23 01:17:28+00:00
1649944637337944070,1051live,Soulja Boy (Big Draco) - She Make It Clap,Soulja Boy,2023-04-23 01:13:50+00:00
1649944398782709762,0xPembertonso,American rapper Soulja Boy accused of scam Twitter promotions and NFTdrops,Soulja Boy,2023-04-23 01:12:53+00:00
1649944330222686210,TacotheBlackGuy,I stumbled upon a Soulja Boy stream. Ngl I'm highly entertained. Not because of him but his chat be wylin,Soulja Boy,2023-04-23 01:12:37+00:00
1649944190644568064,fmraizesnoar,No ar: Soulja Boy Feat. Sammie - Kiss Me Thru The Fone,Soulja Boy,2023-04-23 01:12:04+00:00
1649943853305085952,souljabotem,Soulja Boy shatter em!,Soulja Boy,2023-04-23 01:10:43+00:00
1649943510056067075,RebaBigMcEntire,Old man next to me at the bar Shazamming Crank Dat by Soulja Boy,Soulja Boy,2023-04-23 01:09:21+00:00
1649942441229791234,aka_mourt,Dillon Brooks hasnt even brought out Soulja Boy,Soulja Boy,2023-04-23 01:05:07+00:00
1649940408254775297,hiramboyd,Soulja Boy ....YU CHENG CHANG,Soulja Boy,2023-04-23 00:57:02+00:00
1649940169334878209,rikibon_,"""Soulja Boy - Blowing Me Kisses"" /",Soulja Boy,2023-04-23 00:56:05+00:00
1649939197308936192,markiaulyx,Lmaoo from liturgical to Soulja boy songs I really remember like it was yesterday,Soulja Boy,2023-04-23 00:52:13+00:00
1649937823020228608,LewSidRaps,Yea you wrong just like him. Jim jones has a hit is he top ? Hits do not make you a great rapper. I can,Soulja Boy,2023-04-23 00:46:46+00:00
1649937202246303746,beybreakmysoul,Yall always reposting the same clips from the Beyonc experience but not the one where she does the Soulja boy dance,Soulja Boy,2023-04-23 00:44:18+00:00
1649936269324025856,AlteredBeast40,"Say what you want, Soulja Boy was an absolute hit factory",Soulja Boy,2023-04-23 00:40:35+00:00
1649935381352071170,Defiledl,ayo soulja boy is playing halo rn. poor lad.,Soulja Boy,2023-04-23 00:37:03+00:00
1649934366704029696,blk_bge,Typed in Soulja boy on iTunes and its all hits lol,Soulja Boy,2023-04-23 00:33:01+00:00
1649933201010307072,crispycrispycr,Pretty boy swag - Soulja Boy,Soulja Boy,2023-04-23 00:28:24+00:00
1649932643923038209,heyysmar,Soulja Boy as well fr,Soulja Boy,2023-04-23 00:26:11+00:00
1649931839824429059,KrissyTheMua,I want to go see Soulja boy strictly for Bitches Going Ham. DASSIT/DASALL.,Soulja Boy,2023-04-23 00:22:59+00:00
1649931291339501568,expensive_ramen,Soulja Boy on twitch playing Halo w the dev team &amp; getting his hair braided days after being banned. W Draco,Soulja Boy,2023-04-23 00:20:48+00:00
1649930096461987840,moosedude4,Soulja boy tell em,Soulja Boy,2023-04-23 00:16:03+00:00
1649930096428425217,EnerosVeryOwn,Cue crank that soulja boy,Soulja Boy,2023-04-23 00:16:03+00:00
1649928768650194944,blondrm,SOULJA BOY AII VC SABE NE SDDS,Soulja Boy,2023-04-23 00:10:47+00:00
1649928752535666688,souljabotem,Soulja Boy split em!,Soulja Boy,2023-04-23 00:10:43+00:00
1649925871615225856,2callmehasnat25,ZachXBT Reveals Sketchy NFT Activity of Rapper Soulj,Soulja Boy,2023-04-22 23:59:16+00:00
1649925471445069824,pr1ncessww,if you told me years ago i would have a long distance relationship and our song would be kiss me thru the phone,Soulja Boy,2023-04-22 23:57:41+00:00
1649922888521351169,pandaflo_,Soulja boy,Soulja Boy,2023-04-22 23:47:25+00:00
1649920226618646532,HHNSradio,"Soulja Boy - It's a Bird, It's a Plane . click &amp; play",Soulja Boy,2023-04-22 23:36:50+00:00
1649916924480897026,marta_mace,she crank my soulja til my boy busts,Soulja Boy,2023-04-22 23:23:43+00:00
1649915361888747520,BagAlert500,This ninja a Soulja boy variant.,Soulja Boy,2023-04-22 23:17:30+00:00
1649913981979570180,katiwenz,I think the equivalent for year olds today would be Crank That by Soulja Boy can you imagine?,Soulja Boy,2023-04-22 23:12:01+00:00
1649913652802191360,souljabotem,Soulja Boy sway em!,Soulja Boy,2023-04-22 23:10:43+00:00
1649912221215100928,MattyMaxin,Call my motorcycle Soulja boy the way I love to crank it.,Soulja Boy,2023-04-22 23:05:02+00:00
1649906496635895817,LovexvxHate,-14 Soulja boy biggest fan,Soulja Boy,2023-04-22 22:42:17+00:00
1649900105074462722,Abysmer,Soulja boy I tell em,Soulja Boy,2023-04-22 22:16:53+00:00
1649899850610221056,knighttrack1,Soulja Boy She Make It Clap (Official Video) via,Soulja Boy,2023-04-22 22:15:52+00:00
1649898552540135429,souljabotem,Soulja Boy immured em!,Soulja Boy,2023-04-22 22:10:43+00:00
1649896244133888000,domoluvr123,soulja boy fit for halloween XL shirt XL shorts,Soulja Boy,2023-04-22 22:01:32+00:00
1649895739361751043,TT_FromMTV3,That Daze song with Ja-Bar &amp; Soulja Boy was a banger,Soulja Boy,2023-04-22 21:59:32+00:00
1649893614565093381,1Prying,"rapper Soulja Boy made at least $730,000 from NFT scams",Soulja Boy,2023-04-22 21:51:05+00:00
1649891688159248384,prolejacketgape,-evil soulja boy,Soulja Boy,2023-04-22 21:43:26+00:00
1649886151140950017,SukiGeez,We gonna be cranking that Soulja boy too,Soulja Boy,2023-04-22 21:21:26+00:00
1649885441225523203,jmustafajr,Soulja Boy Tell'em - Speakers Going Hammer,Soulja Boy,2023-04-22 21:18:37+00:00
1649885327337586690,GamereelYT,Soulja boy,Soulja Boy,2023-04-22 21:18:10+00:00
1649883454090166274,souljabotem,Soulja Boy provide em!,Soulja Boy,2023-04-22 21:10:43+00:00
1649882942175432704,RedditJokesBot,Soulja Boy is not even a soldier. Dr. Dre is not even a doctor. Adele is not even a computer.Keep the joke going in the comments.,Soulja Boy,2023-04-22 21:08:41+00:00
1649880125675110412,KHALILHASRISEN,Kids now days dont know the struggle of downloading some new music and it end up being crank dat soulja boy,Soulja Boy,2023-04-22 20:57:29+00:00
1649877408441327620,maaxnnii,how tf soulja boy got his blue check &amp; nicki &amp; bagg dont ?,Soulja Boy,2023-04-22 20:46:42+00:00
1649876804402835458,1checkngang,Soulja Boy Clowns Omi In A Hellcat For Getting Sued By Nike via,Soulja Boy,2023-04-22 20:44:18+00:00
1649876550488137729,HHNSradio,Soulja Boy - On Me . click &amp; play,Soulja Boy,2023-04-22 20:43:17+00:00
1649875532673175557,NicRajThaBarb,A Classic Soulja Boy ft. Birdman &amp; Gucci Mane - Swag Flu (Remix) by keisaunnnn on,Soulja Boy,2023-04-22 20:39:14+00:00
1649875487190048768,MarchelleStant9,"When it comes to cryptocurrencies and NFTs, just because someone is famous doesn't imply they know what they're tal",Soulja Boy,2023-04-22 20:39:04+00:00
1649874923337154560,stanleymwaikamb,My speaker is going hammer from Soulja boy,Soulja Boy,2023-04-22 20:36:49+00:00
1649874120899739655,1checkngang,Soulja Boy Clowns Omi In A Hellcat For Getting Sued By Nike,Soulja Boy,2023-04-22 20:33:38+00:00
1649873970009604098,1checkngang,Soulja Boy Clowns Omi In A Hellcat For Getting Sued By Nike via,Soulja Boy,2023-04-22 20:33:02+00:00
1649873052946284544,dlrowehtfoweiv,Congrats you've won the dumb fuck Tweet of the day Actually,Soulja Boy,2023-04-22 20:29:23+00:00
1649870080270913539,TYonClubhouse,People in entertainment want everything for free.I didn't even know any of these celebrities were ever on Twitter,Soulja Boy,2023-04-22 20:17:34+00:00
1649869601856008192,abstralogist,sharks cant crank that soulja boy not with that attitude,Soulja Boy,2023-04-22 20:15:40+00:00
1649869265988730880,9Urbanscene,Roscoe Dash Feat. Soulja Boy - All The Way Turnt Up,Soulja Boy,2023-04-22 20:14:20+00:00
1649869162766909444,jvice_1,Bones Hyland and Soulja boy the same person,Soulja Boy,2023-04-22 20:13:56+00:00
1649868486666059777,cubicussy,sai call me soulja boy bc i am kissing u thru the phone. you get it. aang was afforded the opportuni,Soulja Boy,2023-04-22 20:11:14+00:00
1649868353362710529,souljabotem,Soulja Boy whispered em!,Soulja Boy,2023-04-22 20:10:43+00:00
